query,label
tell me a fun trivia bit about artificial intelligence,fun_fact
my american express card needs to be reported as stolen,report_lost_card
which restaurants in reno are good for sushi,restaurant_suggestion
can you help me find my lost phone,find_phone
"when asked who you work for, what would you say",who_do_you_work_for
"from december 22nd to the 25th, make me a pto request",pto_request
what hobbies pique your interest,what_are_your_hobbies
what is the rate of interest on my savings account,interest_rate
when did you originate,how_old_are_you
i would like you to revert to your factory settings,reset_settings
what time is it in the mountain standard timezone,time
what's local slang for goodbye in hawaii,translate
i need diy info about jump starting my dead car battery,jump_start
do i have enough pto to take time off,pto_balance
how would i raise my credit spending by 250 dollars,credit_limit_change
help me modify my insurance policy,insurance_change
could i please change your name to alicia,change_ai_name
would you tell me your age,how_old_are_you
make a pto request for dates november 11 to black friday,pto_request
could you tell me what my checking account balance is,balance
what am i listening to,what_song
what is my credit score,credit_score
is there another company you work for,who_do_you_work_for
change the pin on my capital one account to be 1234,pin_change
i want seventy bucks transferred from b of a to chase,transfer
how many calories are in waffles,calories
can you tell me the mpg of this car,mpg
is the level of fuel in my car enough to get me to work,gas
"one or the other, or both",maybe
i need help to make changes to my insurance policy,insurance_change
"are there any travel alerts i should know about for buenos aires, argentina",travel_alert
aaa insurance start new plan,insurance_change
"what time is it in glenwood springs, co",time
i need to know what the latest is with my application for a visa credit card,application_status
could you check to see if my order has been delivered,order_status
i want that repeated,repeat
tell me the fuel my car takes,gas_type
i need help acquiring new insurance,insurance_change
what are your capabilities,what_can_i_ask_you
how is my vacation request looking,pto_request_status
i need to sub sugar for salt,ingredient_substitution
well hello,greeting
add mia to my spanish playlist,update_playlist
is there milk on my shopping list,shopping_list
roll a pair of six sided dice,roll_dice
what do you get if you roll a six sided dice,roll_dice
are car rentals available out of new york from march 2 to march 3,car_rental
can you describe your hobbies to me,what_are_your_hobbies
can you tell me the interest rate,interest_rate
does this car get good mpg in the city,mpg
i'm going to the movies book an uber for 6 people,uber
"when is the next scheduled holiday, please",next_holiday
"at 9 tomorrow, set off the alarm",alarm
i want to pay my water bill,pay_bill
i need you to tell me my salary,income
how long does it take to get to the sky harbor airport,distance
file a report for a lost american express card,report_lost_card
play the next musical number,next_song
are you from the us,where_are_you_from
swap my amex pin to 1234,pin_change
walk me through on how to change my insurance,insurance_change
please also list wash laundry on my to do list,todo_list_update
"i'd like a placed booked in san diego from may 1st, 2020 to june 2nd, 2020",book_hotel
how can i make my own doughnuts/what ingredients,ingredients_list
please call toby,make_call
just another time please,repeat
what's should i call you by,what_is_your_name
what do i have planned on 3/15,calendar
give me the time left before i get to the hotel,distance
how many meetings do i have today between noon and one,meeting_schedule
find out what this song is,what_song
what's the status of my order,order_status
i would like to put carrots on my list for shopping,shopping_list_update
start talking in spanish,change_language
repeal the dinner reservation,cancel_reservation
i am going out of country and my bank needs to be notified,travel_notification
please cancel my 7:30 reservation for morton's,cancel_reservation
when were my tires changed,last_maintenance
i'm having trouble scheduling a meeting,schedule_meeting
it could be that one or the other one,maybe
how's the weather in tallahassee,weather
i need to make a reservation for 8 pm at red robin for 3,restaurant_reservation
is the beltway backed up in traffic on saturday mornings at 11 am during the cherry festival,traffic
"how old are you, again",how_old_are_you
what are some of the attractions in gatlinburg,travel_suggestion
what are the international transaction fees on my amex,international_fees
when was my most recent oil change,last_maintenance
how long until my cereal is ruined,food_last
can i start talking to you in spanish,change_language
i wish to know why my card was declined,card_declined
i would prefer to hear you speak like a british male,change_accent
do you like cat or dogs,do_you_have_pets
can you tell me the best place for cajun shrimp in tampa,restaurant_suggestion
address me by the name stan,change_user_name
are you influenced by someone else,who_do_you_work_for
i need to submit a request for pto for june 12th to june 14th,pto_request
please inform me of the types of subjects are you familiar with,what_can_i_ask_you
do i need shots to go to thailand,vaccines
do you know recipe for making apple pie,recipe
go back to the factory settings for this device,reset_settings
why would a hold have been placed on my checking account,account_blocked
"could you repeat that, please",repeat
i was at costco trying to buy sheets and my card got declined,card_declined
how is my credit score rated,credit_score
what will the apr on my transferred balance be after the first year on my bank of america credit card,apr
can i get a random heads or tails,flip_coin
can you help me figure out how to rollover my 401k,rollover_401k
please link up to my cell,sync_device
how many rewards points do i have for my mastercard,rewards_balance
please help me book a rental car for nashville,car_rental
what are all of the ingredients for brownies from scratch,ingredients_list
where is your home located,where_are_you_from
how much is my water bill,bill_due
that is a completely false statement,no
what type of fuel does my car need,gas_type
can you check when i'm next due for an oil change,oil_change_when
let me call you fred,change_ai_name
can you tell me what the status of my last amazon order is,order_status
what was the amount that i spent on fidelity visa last month,transactions
add up my reward points for master card,rewards_balance
i would like to know what hobbies you enjoy,what_are_your_hobbies
i would like to apply for a new card,new_card
what do you refer to me as,user_name
when will my paycheck be available,payday
how many inches and centimeters would i need if i had 10 feet of something,measurement_conversion
please let me know how much my bills for comcast and sprint total,bill_balance
where should i travel if i want to go to a nice beach,travel_suggestion
when will i be paid again,payday
can you read my to do list to me please,todo_list
what travel alerts are there in china,travel_alert
i need to rent a car in chicago but don't know how,car_rental
how come a hold was placed on my 401k account,account_blocked
please put africa by toto on my playlist,update_playlist
i'd like to hear a joke about donkeys,tell_joke
i really want an italian meal suggestion,meal_suggestion
"please flip a coin, and i call heads",flip_coin
why am i locked out of my bank account,account_blocked
what's the best way to pay my bill,pay_bill
how can i tell what my current location is,current_location
"i ordered some curtains off amazon, can you tell me if it's been shipped yet",order_status
what amount do i make,income
when will i get paid next,payday
i'd like to refer to you as my house from now on,change_ai_name
tell me if you are a human or a computer,are_you_a_bot
advance to the next song,next_song
what is the latest date that i can pay my direct tv bill this month,bill_due
check on the status of my vacation request please,pto_request_status
what kinds of fun touristy things are there to do in boston,travel_suggestion
please request pto for me from march 3rd to march 7th,pto_request
boost volume to 4,change_volume
i'd like a flight from laguardia to orlando on southwest for under $400,book_flight
i would like to compare insurance plan options,insurance_change
could you look up the date that my credit card is set to expire,expiration_date
start speaking in a male british voice,change_accent
do i need a vaccination to go to greece,vaccines
would you unsync the phone now please,sync_device
compare prices for flights from recife to miami leaving may 20 returning june 5,book_flight
are you able to help me pay my mortgage,pay_bill
i'd like your name,what_is_your_name
are you a computer,are_you_a_bot
what animals have alpha males,oos
show me my next day off,next_holiday
i'm in need of checks for bank of america,order_checks
is there gridlock on the street up to the stadium,traffic
find an uber for two passengers we are going to the airport in toledo,uber
why did macy's decline my card,card_declined
"in regards to my wells fargo account, why is there a hold",account_blocked
can i increase the credit limit for my american express card,credit_limit_change
"what is your name for me, please",user_name
what do you think i should make for dinner,meal_suggestion
how many teaspoons in a cup,measurement_conversion
i'd like to know where you're from,where_are_you_from
how much have i spent recently,spending_history
please add roar by katy perry to my playlist,update_playlist
i'd like to find a hotel in tampa that people liked enough to leave good reviews about,book_hotel
what's the title of this,what_song
how many e's are in sesame,spelling
have i been spending a lot on groceries lately,spending_history
please tell me the total calories a single serving of chocolate ice cream is expected to contain,calories
what is the conversion between tablespoons and cups,measurement_conversion
halt that immediately,cancel
what are the steps for setting up direct deposit for my paycheck,direct_deposit
i need to report a lost card,report_lost_card
who fabricated you,who_made_you
what kind of gas should i use to fill the car,gas_type
i need you to find a mechanic for my check engine light,schedule_maintenance
i need to find a nice hotel with solid reviews in seattle,book_hotel
i don't remember where my phone is,find_phone
so when is my flight landing,flight_status
"are you a computer, or are you a real person",are_you_a_bot
i was at trader joe's trying to buy groceries and my card got declined,card_declined
stop syncing with this phone,sync_device
how many minutes to melt cheese,cook_time
how do i cash the reward for city,redeem_rewards
i'm traveling to sweden soon and want to inform my bank,travel_notification
flip a quarter,flip_coin
silence,cancel
talk to me in italian from now on,change_language
favorite what's currently playing on my playlist,update_playlist
when will i need another oil change,oil_change_when
"if i ordered a new card, how long til it comes",replacement_card_duration
how much money was deposited to my bank account from my employer this month,income
what is the total number of vacation days i've used,pto_used
is changing the water filter on my to do list right now,todo_list
"what is your favorite, cats or dogs",do_you_have_pets
are they going to let me take vacation,pto_request_status
is respond to the professor's email on my list of reminders,reminder
can you tell me how to set up a direct deposit,direct_deposit
what is an anachronism,definition
give me the status of flight dl123,flight_status
my friends call me sam,change_user_name
i need to see all visa purchases for march,transactions
"what age were you on your last birthday, ai",how_old_are_you
can you find me a recipe for quiche,recipe
what do i do to get cach back for points on my discover card,redeem_rewards
i want to learn the process of changing oil,oil_change_how
is there any traffic congestion on my way to the closest whole foods,traffic
please unlink my phone,sync_device
how much do i owe on bills,bill_balance
i wanna know the balance of my bank of american account,balance
how many calories are in chocolate ice cream,calories
when can i start boarding my flight,flight_status
let me know how many carry ons i can take on a flight with southwest airlines to dallas,carry_on
how long does it take to cook roast beef,cook_time
i need you to skip this song and play the next one,next_song
when is the expiration date for my visa card,expiration_date
could you tell me what timezone reno is in,timezone
pay my electric bill from my park bank account,pay_bill
what's the traffic like on the way to the amusement park,traffic
find a hotel with great reviews in san francisco,book_hotel
i wanna get some new checks cause i ran out of them,order_checks
give me some restaurant suggestions,restaurant_suggestion
please show me how to share my location with noel,share_location
can you call my cellphone,find_phone
i'm not sure of that,maybe
"i need assistance figuring out how to rollover my 401k, please",rollover_401k
can you help me pay this bill,pay_bill
can you suggest a meal from ireland for me,meal_suggestion
please schedule car maintenance for me,schedule_maintenance
how often should you get an oil change,oil_change_when
is traffic bad on my way to the next mcdonalds,traffic
is this human or a robot,are_you_a_bot
what can i do in new orleans for fun,travel_suggestion
excuse me,repeat
would it be smart to get a plug converter when i visit israel,plug_type
can you help me do math,calculator
"please flip a coin for me, tails i win",flip_coin
tell me how many vacation days i have,pto_balance
would you please get your accent changed to the male british one,change_accent
what kind of petrol goes in the tank,gas_type
how do you spell verisimilitude,spelling
please make a phone call to christopher,make_call
i need to let my bank know i am traveling to paris,travel_notification
can you find the exact amount i pay income taxes,taxes
how can i set up a direct deposit with my checking account,direct_deposit
what is my health plan,insurance
can you locate my package,order_status
is it safe to travel to norway,travel_alert
is it possible to change to original settings,reset_settings
that's a negative,no
put dr feelgood by motley crue on my playlist,update_playlist
is there a travel alert for north korea,travel_alert
you can remove vacuuming off the todo list,todo_list_update
what is the amount of money that i have to pay in taxes,taxes
how much am i allowed to spend on my discover card,credit_limit
clear my calendar for tomorrow,calendar_update
either one would work,maybe
are you able to link to my phone,sync_device
how do i start my car battery,jump_start
whats euros kroner in 25,exchange_rate
next song play,next_song
are you able to figure out where my package is,order_status
how can i rollover my 401k at my new job,rollover_401k
add soda on my shopping list and remove carrots,shopping_list_update
use your quiet voice,whisper_mode
how long does bread last,food_last
i will need an uber for 2 people to get to philadelphia,uber
what can i ask you,what_can_i_ask_you
what have i spent lately in child care,spending_history
i want you to roll a dice,roll_dice
i need to know how to spell excellent,spelling
how is the traffic on my way to the venue,traffic
i have to schedule somewhere get my tires checked out,schedule_maintenance
convert 2 inches to meters,measurement_conversion
can you please tell me my card's expiration month,expiration_date
who are the people responsible for you,who_made_you
can you please locate my phone,find_phone
how many calories in this slice of pizza,calories
how can i say i love you in italy,translate
does delta charge for carry ons,carry_on
tell me some good mexican restaurants in dallas,restaurant_suggestion
what do you like to do when you have spare time,what_are_your_hobbies
can you tell me the apr on my visa card,apr
i'm intereted in requesting pto from april 1-5,pto_request
can i use flour instead of cornstarch to make gravy,ingredient_substitution
you can cancel my reservation,cancel_reservation
in what timezone does baton rouge fall,timezone
"if my car battery is dead, what action do i need to do",jump_start
what is the apr for the credit card,apr
how old are you exactly,how_old_are_you
"in pacific time, what's the current time",time
i need the routing number for my woodlawn account,routing
translate for me hello into french,translate
oops cancel that,cancel
how much is in savings,balance
what's the temperature like in tampa,weather
please give me directions to the nearest starbucks,directions
tell me how to set up a direct deposit,direct_deposit
how many years are you,how_old_are_you
i need a meeting scheduled with bob for 7:00am on 9/11,schedule_meeting
do you change the oil in your car more than once a year,oil_change_when
what's it been costing me to buy three packs a day,spending_history
pay my gas bill from my saving account,pay_bill
who did the programming for this ai,who_made_you
tell me how i can get a new pin number,pin_change
how do you spend your spare time,what_are_your_hobbies
tell me what i put on the shopping list,shopping_list
what were my last five transactions on my visa card,transactions
"yes, that is right",yes
i need you to set an alarm for 8am tomorrow,alarm
say it one more time,repeat
let's speak in mandarin instead of english,change_language
check the wait time for macaroni grill,how_busy
restore my factory settings immediately please,reset_settings
when do i get my next check,payday
how much did i spend the past 3 days,spending_history
what sort of fuel should i use for this car,gas_type
will a loan lower my credit score,improve_credit_score
"x has given me an interest rate, what is it",interest_rate
i want to know how to correctly spell cemetery,spelling
how much is my current cable bill for,bill_balance
please increase the volume to 4,change_volume
please increase the volume to 4 please,change_volume
costa mesa weather,weather
please say the apr for my credit card,apr
what is the due date for my metronorth monthy pass,bill_due
"can you help me book a bmw suv for march 2 to 6th, dallas texas",car_rental
how can i apply for a discover card,new_card
what reminders did i have,reminder
i have to schedule some car maintenance,schedule_maintenance
is a plug converter required for haiti,plug_type
what are some fun things i can partake in in atlanta,travel_suggestion
i would like to know the usd to aud conversion rate,exchange_rate
is it possible to get more checkbooks for my wells fargo checkings,order_checks
will you confirm my reservation for red robin at 10,confirm_reservation
please list nearby restaurants with 4 or more star reviews,restaurant_suggestion
do they take reservations at bjs,accept_reservations
what does my income amount to,income
how much money have i spent this month,spending_history
ai can you tell me what things i may ask,what_can_i_ask_you
how much is my electric bill for,bill_balance
do you know exactly when you were born,how_old_are_you
what is the minimum i need to pay for my cell phone bill,min_payment
tell me the status of flight dl123,flight_status
i'd like you to roll a 6 sided dice,roll_dice
how can i get you to help me,what_can_i_ask_you
how do i book a vacation,pto_request
what is that tax form that shows my wages and where do i get it,w2
"can i make a reservation for 3 at state bird for 8:30, please",restaurant_reservation
what's the now playing song that we are listening to,what_song
i'm really not sure,maybe
you will be called rose from now on,change_ai_name
i gotta apply for a new credit card,new_card
add farm trip to my calendar for friday,calendar_update
can you tell me how many vacation days i've taken,pto_used
i'd love to order some more checks for my checking account,order_checks
"i need the dollar amount due on my verizon bill, please",bill_balance
i need a reminder,reminder_update
whats your take on the meaning of life,meaning_of_life
how long before my lawn guy bill's due,bill_due
would you like to live with a cat or a dog,do_you_have_pets
help me convert feet into miles,measurement_conversion
when did i get my last paycheck,payday
what timezone is philadelphia in,timezone
to what extent until the following free day,next_holiday
i would like to try and confirm that i have a reservation at la palapa for bolding,confirm_reservation
let me know how to get to the starbucks nearby,directions
please read my reminders,reminder
add jake's birthday party for friday at 5,calendar_update
can you put in a meeting for the blue room on friday,schedule_meeting
"can you connect to my phone, please",sync_device
has my credit card application gone through,application_status
please fill me in on the nutrition facts for shrimp scampi,nutrition_info
my card is to be reported stolen,report_lost_card
i believe there are fraudulent charges on my card how can i report them,report_fraud
how much is my apr on my bank of america card,apr
i had a list of reminders what were they,reminder
what type of gas am i allowed to put in this car,gas_type
how do i utilize my credit card points,redeem_rewards
i want to hear something funny,tell_joke
how many days was i sick or on vacation,pto_used
how many miles is there left to get to sioux falls,gas
when do i need to change my tires again,tire_change
what steps do i need to do to set up direct deposit,direct_deposit
"erase get a haircut from my to do list, please",todo_list_update
"i will be in uruguay from january to august, please let me bank know",travel_notification
what can you help me with exactly,what_can_i_ask_you
do you know what timezone italy is in,timezone
that would be a no,no
where do i begin the process of reporting my luggage lost,lost_luggage
can you increase my credit limit,credit_limit_change
french time zone,timezone
tell me the complete spelling of definitely,spelling
tell me if i need any more vaccines if i go there,vaccines
can you please help me find my lost luggage,lost_luggage
i'd like to cancel the party of 7 we reserved at the olive garden,cancel_reservation
what is the weather like in sparks right now,weather
does longhorn steakhouse have good reviews,restaurant_reviews
show me the transaction on mcdonald,transactions
let me know the carry on policy for alaska airlines,carry_on
does delta have any carry-on restrictions,carry_on
can you show me roundtrip flights from dallas to los angeles from march 2 to march 10,book_flight
what year is it,date
i need a hotel room that can host 5 people from tomorrow to saturday in denver,book_hotel
please read back to me my to do list,todo_list
when does milk expire,food_last
report my card as lost,report_lost_card
"in the eastern timezone, what time is it now",time
what do i do to find my current location,current_location
what kinds of questions can you respond to,what_can_i_ask_you
where can i see my credit score,credit_score
will i be charged for using my card in japan,international_fees
good evening,greeting
what are ai's hobbies,what_are_your_hobbies
what can you tell me about miami weather,weather
do you know the name of your boss,who_do_you_work_for
i would like to hear the next tune on this particular playlist,next_song
i would like to change your name to eli,change_ai_name
please set the volume to 4,change_volume
"could you connect with my phone, please",sync_device
can you spell water,spelling
please tell me the procedure to cash in my rewards for my citibank card,redeem_rewards
delete the hair appointment i had scheduled on may 1st pleae,calendar_update
please pay my bill,pay_bill
do you know any fun facts about australian football,fun_fact
do you have nutrition facts for cheerios,nutrition_info
i'm looking for a roundtrip flight from aaf to dia for february 23rd to february 28th,book_flight
how many cups are in 4 quarts,measurement_conversion
do i need a socket converter if i'm going to be in russia,plug_type
you can call me cindy,change_user_name
please cancel that last task,cancel
what do you have me saved under,user_name
do i need a vaccination to go to china,vaccines
can you please confirm that i have a 6:00 pm table reserved under michelle solomon at devon's,confirm_reservation
take lunch off my calendar on the 3rd,calendar_update
help me find where i am,current_location
when did i last bring my car in to have it looked at,last_maintenance
reset the factory settings if possible,reset_settings
please reserve me a table for 2 pm at maxwell's on the 14th,restaurant_reservation
would you tell me the interest rate,interest_rate
you need to go back to the original settings,reset_settings
how would i say if i were english subway,translate
have you heard anything back on my cc application,application_status
"i need to cook, what should i make",meal_suggestion
return to default settings,reset_settings
i would like a reorder of checkbooks for my home equity line of credit with chase,order_checks
what ingredients do i need for philly cheesesteaks,ingredients_list
put this song in vibes playlist,update_playlist
i need $20000 transferred from my savings to my checking,transfer
can you play music the beatles,play_music
where do i go to get my w-2,w2
where is your place of origin,where_are_you_from
what are you hobbies,what_are_your_hobbies
at free time what do you do,what_are_your_hobbies
can you tell me how to jump a car,jump_start
what name do you want me to call you,what_is_your_name
do travelers to egypt get hit with transaction fees if they're using a mastercard,international_fees
"go to next song, please",next_song
what is three quarters of one sixth,calculator
id like a rental car in denver colorado between january 1st and january 3rd and id like a ford if possible,car_rental
