query,label
change the pin on my redwood credit union account to be 1234,pin_change
rename yourself to betty,change_ai_name
do i have to pay for carry-ons on delta,carry_on
how long's it been since my car was at autozone,last_maintenance
when do my tires need changing,tire_change
"talk slower, please",change_speed
"ai, what do people call you",what_is_your_name
put the song that's playing to my techno playlist,update_playlist
stop using the whisper mode,whisper_mode
can you help me find my phone,find_phone
"can you tell me the meaning of life, please",meaning_of_life
pay the electric bill,pay_bill
how many lira can i get for 250 dollars,exchange_rate
do you know anything funny about cats,tell_joke
what timezone is los angeles in,timezone
what is our purpose in life,meaning_of_life
is traffic bad on the way to chicago,traffic
give tom my location,share_location
start my vehicle,smart_home
"i'd like to report my card as damaged, it's bent",damaged_card
yellow by coldplay to my playlist please,update_playlist
i need to locate my phone,find_phone
i'd like to reset to factory settings,reset_settings
when did they deposit my last salary,payday
what kind of pets do you own,do_you_have_pets
can you tell me the expiration date for my mastercard,expiration_date
how can i take a bus to dallas,directions
make delta reservation from madison to atlanta,book_flight
what are the main attractions in gatlinburg,travel_suggestion
find my credit score,credit_score
i wanna schedule some car maintenance,schedule_maintenance
what's the best place to just get away from it all,travel_suggestion
new playlist that i will add god's plan to,update_playlist
please confirm that opening a new account can decrease your credit score,improve_credit_score
list everything on my shopping list,shopping_list
what are the benefits of completing college,oos
how do i see me rewards for my chase card,rewards_balance
what are the nutrition facts for a mcdouble at mcdonalds,nutrition_info
do you own any pet at all,do_you_have_pets
has anyone looked over my request for a day off,pto_request_status
what do they call you,what_is_your_name
i really need you to confirm my reservation for kevin at red robin,confirm_reservation
what's my apr on the card i recently used to make a purchase,apr
how much is the minimum payment on my chase card,min_payment
"yes, that's correct",yes
please look up if i can rent a car in houston from march 25 to march 29,car_rental
is it okay to listen to elvis' music,play_music
tell me the amount of gas i have,gas
update me on the status of my credit card application,application_status
book a flight from denver to austin on the 16th and returning on the 20th,book_flight
what pets do you currently own,do_you_have_pets
do i need a tourist visa for europe,international_visa
i am not confident on that,maybe
can i get some music by three six mafia in here,play_music
can you check where my luggage is off jetblue flight ab123 out of buffalo,lost_luggage
what kind of mpg does this car get in the city,mpg
what's the point of everything,meaning_of_life
how can i find my routing number for el dorado,routing
please remove the phone's sync,sync_device
how many dollars can i exchange for 200 yen,exchange_rate
i want to play my maroon 5 playlist,play_music
what type of restaurants are nearby,restaurant_suggestion
tell me some interesting trivia about dinosaurs,fun_fact
how many centimeters are in an inch,measurement_conversion
i need to know who programmed you,who_made_you
"what do you suggest for entertainment in tampa, florida",travel_suggestion
tell me everything on my calendar for may 1,calendar
what's my income,income
"open up a reminder, pay taxes on monday",reminder_update
send ally a text message the message is that i just landed,text
are my tires due to be changed soon,tire_change
put on my jam session playlist please,play_music
lets flip for it,flip_coin
i wish to request a change in insurance plans,insurance_change
how bad is the traffic waiting for the staten island ferry at 8 am,traffic
what's my limit on my visa card,credit_limit
my card is cracked and i want to report it,damaged_card
how can i look at rewards for my amex card,rewards_balance
remove the recurring training meeting events off my calendar,calendar_update
time in tokyo,time
count the number of vacation days i've taken and tell me,pto_used
please tell me if i need any shots before i go to mexico,vaccines
can you tell me how old the ai is,how_old_are_you
what kind of oil do i need to use for my car,oil_change_how
find out how much of my pto is already used,pto_used
i go by brad,change_user_name
i have a lot of credit card points saved up and would like to start redeeming them,redeem_rewards
i want to switch speaking to french,change_language
what's the total of days i've taken for me time so far,pto_used
should i purchase a new plug converter when in france,plug_type
can i initiate a one-time transfer from my savings account to my money market account,transfer
what is the due date of my bill,bill_due
what are the reviews like for la camelia,restaurant_reviews
what plugs are used in spain,plug_type
i wanna know my current location,current_location
tell me how i can schedule a meeting,schedule_meeting
can you rise the volume of this please,change_volume
i just found a better job and need to move my 401k over to my new employer,rollover_401k
i would like you to think of yourself as machine and answer when i say your name as such,change_ai_name
nada,no
"name this song, please",what_song
have a good one,goodbye
when do i change my oil,oil_change_when
i need the new due date for my pgw gas bill,bill_due
would you tell me my routing number,routing
can you forward my location to tom,share_location
skip over this song,next_song
are the pancakes at ihop any good,restaurant_reviews
i need to know my b of a interest rate,interest_rate
can you tell me jet blue airlines' carry on policy,carry_on
add to my playlist smooth operator by sade,update_playlist
can you help me find my luggage it was lost on delta flight abc123 from houston,lost_luggage
what do i need to do for my mastercard rewards,redeem_rewards
roll an eight sided die,roll_dice
what transactions did i make yesterday at the flea market,transactions
does bjs take reservations,accept_reservations
what am i supposed to be doing today,calendar
how can i roll over my 401k,rollover_401k
i need to know what my to-do list is looking like,todo_list
is fixing mom's kitchen blind on my to do list,todo_list
how did you come to be you,who_made_you
can you let me know what my credit limit is for my visa card,credit_limit
what kind of pto do i have left,pto_used
is my day off approved,pto_request_status
i need to know what the date is today,date
has the order that i placed arrived,order_status
is it possible to rent a car from new york on 3/2/19 to 3/5/19,car_rental
is it possible to use sausage instead of hot dog,ingredient_substitution
what temperature is the ac set at,smart_home
your answer was good,thank_you
my insurance plan needs to be changed,insurance_change
would you say i need new tires if i last bought them on the 24th,tire_change
i wanna change your name to audrey,change_ai_name
good seeing you,goodbye
who do you function for,who_do_you_work_for
can i reserve a table for 2 at the olive garden at 8,restaurant_reservation
what's the current time in est,time
how many pto days do i have left,pto_balance
please set a timer for me,timer
how busy is michel at 9,how_busy
can you tell me how much i pay in taxes,taxes
can you find my credit score,credit_score
what southwest flights are there for lax to sfo arriving april 1st and returning april 7th,book_flight
i want to know how many vacation days i have,pto_balance
what is the current time in mexico city,time
what's td bank's interest rate,interest_rate
where should i book my next trip,travel_suggestion
let me know the name you have for me,user_name
book an uber to school,uber
i want to know who made you,who_made_you
i need to know how healthy meatloaf is,nutrition_info
good looking out,thank_you
when do i need to pay my annual payment for auto insurance,bill_due
cancel action,cancel
will i need a visa to visit ireland,international_visa
can you tell me a joke about politicians,tell_joke
are you from europe,where_are_you_from
i must find the interest rate for my checking account,interest_rate
update me on my vacation request,pto_request_status
whereabouts are you from,where_are_you_from
"please add to my calendar for the staff meeting that is scheduled on march 1, 2019 at 10 am",calendar_update
i want you to be in whisper mode now because i am in the library,whisper_mode
"can you schedule a meeting with james at the office, please",schedule_meeting
when do you think i should replace my tires because i replaced them on 12/21/17,tire_change
please set the temperature to 70,smart_home
will you flip a coin,flip_coin
tell me when i get paid,payday
i cannot recall the pin for my savings account,pin_change
i would have to say the answer to that is no,no
decrease volume to 4,change_volume
uh-huh,yes
i need to find out how i know my location right now,current_location
how is life treating you,greeting
i would like to make a pto request for july 17th and 18th,pto_request
take bread off my shopping list and add milk,shopping_list_update
i need a 7 minute timer,timer
can you show me how to set up direct deposit,direct_deposit
do they take reservations at mendy's,accept_reservations
"roll that dice, ai",roll_dice
can you look up what my shopping list has on it,shopping_list
will you add what i'm listening to to my road trip playlist,update_playlist
i want to cancel my reservation for 5 at red robin,cancel_reservation
what is your take on the meaning of life,meaning_of_life
can i increase my credit limit from 1000 to 2000 please,credit_limit_change
give me a rundown of the weather,weather
"i didn't catch that, please repeat",repeat
are you real or are you an ai,are_you_a_bot
can i get more money on my discover card,credit_limit_change
what's the usual time to get a new card when your previous one was lost,replacement_card_duration
how soon will you mail me a new card,replacement_card_duration
what do i owe in federal taxes,taxes
is it possible for me to rent a car out of jfk airport from march 15-20,car_rental
bye now,goodbye
lets pass on this song and do the next,next_song
please clear out my whole to do list,todo_list_update
what kind of oil do i need to get and use for my car,oil_change_how
i'd like a reservation for 2 at olive garden for 5 pm today,restaurant_reservation
i need you to confirm my reservation for outback steakhouse at 6,confirm_reservation
can you give me info on miami weather,weather
please inform me of the minimum payment of the bill,min_payment
please take shoveling the car off my todo list,todo_list_update
how do i get a personal w2 form,w2
what do i have on my calendar for march 2,calendar
i need to switch to the male voice,change_accent
figure out why there is a block on my account please,account_blocked
how much is 500 dollars in pesos,exchange_rate
how long before my amex card expires,expiration_date
"when you talk to me, use bob",change_user_name
who do yo work for,who_do_you_work_for
what were my purchases on visa card last month,transactions
what amount of millimeters are in 50 kilometers,measurement_conversion
tell me what the date is today,date
what is your birthday again,how_old_are_you
how long does visa take to get me a new card,replacement_card_duration
switch tv,smart_home
what song is playing,what_song
are any meetings scheduled for today,meeting_schedule
did i put bread on my shopping list,shopping_list
whats my gas mileage,mpg
can you confirm the date my last paycheck was received,payday
when is my credit due to expire,expiration_date
i need some work done on my car so need to schedule auto mechanic for maintenance,schedule_maintenance
when was the last time i got paid,payday
what's a good recipe for chicken divan,recipe
please tell my bank i will be in israel from the 6th to the 23rd,travel_notification
can you translate milk into spanish for me,translate
what's the exchange rate between dollars and pesos,exchange_rate
what does your boss go by,who_do_you_work_for
whats up,greeting
"if i am in reno, what would the timezone be",timezone
can you read me my list of reminders,reminder
i need to know when i get my next day off,next_holiday
tell me a joke about lawyers,tell_joke
can you report my lost discover card,report_lost_card
where can i see art,oos
please confirm my reservation for april 1st at 9am,confirm_reservation
could you tell me your name,what_is_your_name
how do i make that scottish dish with all the blood and sausage,recipe
can you call russell,make_call
look up the time in california,time
can i get you to talk like a pouty english guy,change_accent
i was at safeway trying to buy groceries and my card got declined,card_declined
what's the eta for a new card to come in the mail,replacement_card_duration
can you remind me of when i last had an oil change,last_maintenance
can you cancel what you were doing,cancel
i need to send my current location to sean,share_location
please connect with my smart phone,sync_device
you can call me michael,change_user_name
what's the answer to existence,meaning_of_life
what other names can i give you,change_ai_name
i want an alarm at 5pm,alarm
how much have i spent eating out this week,spending_history
i see a fraudulent transaction from netflix on my account,report_fraud
please text nancy and give them the message that i am on vacation,text
"cancel my last request, i know the answer",cancel
do people like the donuts at tgi,restaurant_reviews
please your volume,change_volume
what's on the reminder list,reminder
does my chase card have international transaction fees,international_fees
you can call me brandon,change_user_name
read my shopping list to me,shopping_list
any hobbies,what_are_your_hobbies
i need to be reminded to pray,reminder_update
i want to add a doctor's visit to the calendar for friday,calendar_update
i didn't hear say it again please,repeat
turn the volume to 4,change_volume
when do cars need their oil changed,oil_change_when
my next payday,payday
tell me what cas is needed for this car,gas_type
check to see if i have reservations at prado at 6 pm,confirm_reservation
make up a new alarm,alarm
how can i improve my credit score,improve_credit_score
help me flip a coin,flip_coin
i need to transfer from one account to my second one,transfer
what is the area of a 20 x 20 room,calculator
what did i write down on my shopping list this time,shopping_list
can i make it to work with my current fuel level,gas
what vaccinations are required to enter paris from outside the country,vaccines
what is my next day off,next_holiday
i need a hotel in new orleans with awesome reviews,book_hotel
my transaction history,transactions
when can you send me a replacement card,replacement_card_duration
switch over to whisper,whisper_mode
could you please switch to whisper mode,whisper_mode
what is the exchange rate in pesos for 100 dollars,exchange_rate
can you get the fan going in here,smart_home
so my card was declined at fry's and i wanna know why,card_declined
share my location with ben and jerry,share_location
can you tell me the meaning of life,meaning_of_life
play me some music,play_music
let my bank know that i'm traveling to prague,travel_notification
what does the forecast look like,weather
i must order some more checks for my checking account,order_checks
can you schedule a meeting for me,schedule_meeting
i need an alarm at 8 pm,alarm
help me find a new auto insurance policy,insurance_change
order a large uber for 5 people to the zoo,uber
take doing the dishes off my todo list,todo_list_update
the word 'you' got how many letters,spelling
"where can i get the form i need to do my taxes, please",w2
where should i go to get a w2 to do my taxes,w2
how high is my credit limit for my citigroup card,credit_limit
could you check my bank balance for me,balance
where do i recieve a w2,w2
"i am going to asia in a bit, i should tell the bank",travel_notification
write apples on my shopping list,shopping_list_update
can i pay my bill,pay_bill
"correct, it is affirmative",yes
please let me know the credit limit on my citibank card,credit_limit
get connected to my phone,sync_device
it is definitely affirmative,yes
how do i find when my electric bill is due,bill_due
i want my chase account blocked immediately,freeze_account
on may 12 to may 16 can i get a car from aiken,car_rental
how do i change my car oil,oil_change_how
i'm going to start calling you alice,change_ai_name
will i be charged if i use my card in detroit,international_fees
use female voice now instead,change_accent
what's with the block on my bank account,account_blocked
last time car was in shop,last_maintenance
how's my tire pressure,tire_pressure
report the card has been torn,damaged_card
how can i get new insurance,insurance_change
please tell me the minimum amount i can pay on my wells fargo credit card,min_payment
how do i do an oil change and what type do i use,oil_change_how
what did i spend on groceries this month,spending_history
can i use the plug i use at home when traveling in south america,plug_type
my reservation is no longer needed,cancel_reservation
what is the track title of the song playing,what_song
what funny joke do you know,tell_joke
can you help me with some fraudulent charges on my card,report_fraud
what's the date on which my last oil change occurred,last_maintenance
can i increase my credit limit to 1100 dollars,credit_limit_change
i want to know the nutrition info for chicken nuggets,nutrition_info
i need a reminder to remind me to do something,reminder_update
purchase all the things on my shopping list,order
will i be safe while traveling to lyon (will you be safe),travel_alert
please change the name you refer to me by,change_user_name
who would you say that you are working for,who_do_you_work_for
do you know why the bank put a hold on my joint checking account,account_blocked
how much time off do i have left,pto_balance
is there an insurance plan for my health,insurance
i'd like it to be louder,change_volume
give me a hand finding my mobile device,find_phone
i just used up my toothpaste and need you to order more,order
my luggage is lost and i would like help trying to locate it,lost_luggage
when will my order be here,order_status
where is your family from,where_are_you_from
how many pints are in 22 gallons,measurement_conversion
which mexican meal would be good,meal_suggestion
what does the carry-on policy say for flights on united airlines,carry_on
im sorry can you repeat yourself,repeat
i need to know what i spend on utilities for the last year,spending_history
is there a meaning in life,meaning_of_life
what's your place of manufacture,where_are_you_from
create a timer for me,timer
do i have carrots on my shopping list,shopping_list
book a reservation for 2 at olive garden under the name jim,restaurant_reservation
can you play right above it,play_music
which company is responsible for your design,who_made_you
change your name to something funny,change_ai_name
what time is it,time
find the applicable timezone for austin,timezone
look up the calories in an apple,calories
am i able to increase the limit on my visa card,credit_limit_change
how many days have i taken off this year,pto_used
i want to check on my vacation request,pto_request_status
"what is the distance to austin city limits from my hotel , the holiday inn at austin",distance
how old are your pets,do_you_have_pets
tell me the calorie content for an apple,calories
how should i prepare to change my own oil,oil_change_how
is the tofu i put in the fridge tuesday still edible today,food_last
set the temperature to 78,smart_home
when do i need to change the oil again,oil_change_when
please give me the expected arrival date for my next paycheck,payday
i want to to schedule maintenance on my vehicle,schedule_maintenance
do you know where my phone is,find_phone
i really don't have a clue,maybe
on what date does my visa card expires,expiration_date
how busy will golden corral be at 7:30 tonight,how_busy
is austin in the central timezone,timezone
can you tell me when my credit card application will be processed,application_status
i need to know how many r's are in restaurant,spelling
please tell me how many vacation days i currently have,pto_balance
"sorry, you can actually stop that",cancel
i need to change my insurance to a plan with a lower deductible,insurance_change
i need ten dollars sent from b of a to washington mutual,transfer
what is the average time to go between oil changes,oil_change_when
do you think longhorn steakhouse will be busy at 5pm,how_busy
thanks for the help!,thank_you
what year were you born,how_old_are_you
what was the problem with my card yesterday,card_declined
"could you tell me the meaning of life, please",meaning_of_life
i was at zales trying to buy a ring and my card got declined,card_declined
confirm that buy a light bulb is on my list of reminders,reminder
volume needs to be at 4,change_volume
suggest a meal from korea to me,meal_suggestion
my stolen card needs to be reported,report_lost_card
i want a coin flipped,flip_coin
"if i'm planning to go to the uk, do i need a visa",international_visa
what are the best sushi restaurants in reno,restaurant_suggestion
call someone for me,make_call
i want to be woken up at 9 tomorrow,alarm
how do i properly give my car a jump,jump_start
what's the recipe for rice noodles,recipe
can you give me a thai dinner suggestion,meal_suggestion
can you get rid of my trip to the zoo from my calendar on march 1st,calendar_update
it was enjoyable to chat with you,goodbye
why did my bank account freeze,account_blocked
let me know the list of transaction on my first hawaiian bank,transactions
at yakamoto how is their sushi,restaurant_reviews
say a fun fact about mt everest,fun_fact
can you help me pay my phone bill,pay_bill
what is the validity of my credit card,expiration_date
is it possible to get a credit limit increase to 3000,credit_limit_change
please inform me of what tasks i have listed on my to do list,todo_list
how much in total do i need to pay cox and at&t,bill_balance
whats my delta flight's status,flight_status
can you tell me about my credit rating,credit_score
when will my car need an oil change,oil_change_when
what is the status of the application for a credit card i put in,application_status
what's the traffic like around the stadium,traffic
check to see how long of a wait i would be facing if i go to outback steakhouse,how_busy
i want to know the type of gasoline for this car,gas_type
how many days are left for me for vacation if i may ask,pto_balance
can you tell me about the nutrients in jello,nutrition_info
transfer $500 from my money market savings account to my checking account,transfer
how much is my income tax,taxes
"my card is cracked, please tell the card company",damaged_card
i want to visit portugal do i need a travel visa,international_visa
what is the caloric total in these muffins,calories
disconnect from my phone,sync_device
remind me to bring a jacket in tomorrow,reminder_update
would you remove bread from my shopping list and add bread,shopping_list_update
would you please cancel the reservations for dinner,cancel_reservation
i must know my visa card's apr,apr
can i swap cayenne pepper for black pepper,ingredient_substitution
i need you to check if my credit card points are redeemable right now,redeem_rewards
halt,cancel
put milk on my shopping list cause i'm out of it,shopping_list_update
i think it could be either one,maybe
tell me how many vacation days i have left,pto_balance
how long should i expect to wait for my new card in the mail,replacement_card_duration
how do i jump start the car,jump_start
does my calendar have anything for january 1st,calendar
i need to report a new card please the atm hurt mine,damaged_card
can you share my current location with amy,share_location
do i have any meetings scheduled between 3 and 5 pm today,meeting_schedule
when should i expect my flight to come in,flight_status
what can i address you,what_is_your_name
what is my name saved under,user_name
give liz a call,make_call
how's my interest rate,interest_rate
can i get the routing number for my boa account,routing
can i schedule a car repair,schedule_maintenance
give me the specifics on my federal taxes,taxes
is there anything i can't ask you,what_can_i_ask_you
what kind of outlets does havana have,plug_type
remove wine and add beer to my shopping list,shopping_list_update
please call me frank from now on,change_user_name
"book a flight from key west, fl to san antonio, tx on 18 february 2019 and returning on 5 march 2019",book_flight
what fees are charged if i use something in paris,international_fees
how do i schedule car maintenance,schedule_maintenance
i want the calorie content for a banana,calories
tell me a fun fact about tigers,fun_fact
hi there,greeting
is it possible for you to whisper for me,whisper_mode
my amex rewards; how do i get them,redeem_rewards
trey needs my current location,share_location
what do the plugs look like in japan,plug_type
whats dollars won in 15,exchange_rate
i want to know what the latest is on my vacation request i submitted,pto_request_status
flip a coin one time,flip_coin
send $100 from paypal to my bank,transfer
is a socket converter required if i travel to russia,plug_type
skip to the next song please,next_song
remove moms birthday from calendar,calendar_update
how would i go about converting inches to yards,measurement_conversion
i would like to change your name to a different one,change_ai_name
my card got melted and i need to report it,damaged_card
the speaker volume needs to be increased,change_volume
can you figure out how many vacation days i have left,pto_balance
i know it could be either one,maybe
i can't use my card because it is broken,damaged_card
