query,label
are there any steps i need to take to use my credit card points,redeem_rewards
what is the traffic situation at the olive garden restaurant,traffic
how do i know where i'm at,current_location
costa mesa current weather,weather
can you give me an overview of what march 23 will look like for me,calendar
"which domestic animal do you prefer, dog or cat",do_you_have_pets
apply for a bank of america travel rewards credit card,new_card
tell me the right kind of gas for this car,gas_type
"hey ai, reduce your speed of speaking",change_speed
when is my car due for an oil change,oil_change_when
i would like to apply for a green card,new_card
what are the nutrition facts of grilled chicken,nutrition_info
i would like to know when the bill is due,bill_due
"my card was declined yesterday, why",card_declined
could you talk like a british male,change_accent
how many canadian dollars can i exchange for 200 yen,exchange_rate
im at lax and my bags aren't,lost_luggage
is there a location i can schedule to check out my tires,schedule_maintenance
i want to know how busy ruby tuesday will be at around 8:45 pm,how_busy
revise the ai name,change_ai_name
could you slow down your speech,change_speed
how many miles before i need my tires changed,tire_change
what do you have answers for,what_can_i_ask_you
i need to know how to spell conscience,spelling
when should my oil be changed,oil_change_when
would you say that you are human or copmuter,are_you_a_bot
nice to see you,goodbye
whats pesos australian dollars in 20,exchange_rate
read my reminders please,reminder
tell me if there is an event called annual physical in my calendar,calendar
any good pizza restaurants around here,restaurant_suggestion
i have to report a lost visa card,report_lost_card
i want a meeting to be scheduled,schedule_meeting
how many calories does a big mac have,calories
do i have many meetings today between 2 and 4,meeting_schedule
i want for you to connect to my phone,sync_device
how long do i put the casserole in,cook_time
start the timer now and stop at thirty minutes,timer
i want us to speak to each other in spanish from now on,change_language
did you get confirmation my vacation is a go,pto_request_status
what sort of things do you enjoy,what_are_your_hobbies
when should i replace my tires if i replaced them last year,tire_change
is there evening reservations available in the eve,accept_reservations
please create an alarm for 5:45 am and an alarm for 6:15 am,alarm
search my calendar for birthday party,calendar
what's the latest joke you've heard,tell_joke
i would like a block put on my chase account asap,freeze_account
what timezone is melbourne in,timezone
check my calendar for 30th birthday party,calendar
do they take reservations at state bird,accept_reservations
can you tell me what is 18 percent of $2500,calculator
my checking account has a hold on it and i need to know why,account_blocked
review of my card apr,apr
how much can i spend on my visa card,credit_limit
book a 6 person uber to the movies,uber
how do i report fraud on my discover card,report_fraud
is it possible to have a place booked in salem from the 1st to the 3rd,book_hotel
what is the lowest amount i can pay for my cable bill,min_payment
dollar to pesos exchange rate,exchange_rate
please tell me all of my recent transactions,transactions
i need to know what is currently on my calendar for friday the 1st,calendar
pets you have what kind,do_you_have_pets
a rental car needs to be booked in nashville,car_rental
tell me what's on my reminders list please,reminder
play one song forward,next_song
what is the amount of vacation days i have left,pto_balance
what is my points total for my mastercard,rewards_balance
i would like to know tomorrow's date,date
do you know if my reservation for dono is confirmed at 8 pm,confirm_reservation
can you make a phone call to dave,make_call
alert my bank and tell them that i'm travelling to paris,travel_notification
how many miles can i drive before changing my oil,oil_change_when
how can you schedule a meeting for me,schedule_meeting
my bank account must be frozen,freeze_account
by what name people call me,user_name
what day is it,date
how many kilos are in 100 pounds,measurement_conversion
please desync my current mobile,sync_device
what are the weather conditions in seattle,weather
do i have enough fuel for the drive to tampa,gas
please show me what transactions i made on the first of this month,transactions
is being alive the meaning of life,meaning_of_life
assist me with finding an uber to big ben,uber
what times are my meetings,meeting_schedule
what is the minimum i can pay for my light bill,min_payment
i'd really like to set up a direct deposit for my paycheck,direct_deposit
please put silverware on my list for shopping,shopping_list_update
what is the square root of sixteen,calculator
turn on the whisper voice,whisper_mode
can you slow down,change_speed
can you find a good steakhouse for tonight,restaurant_suggestion
how long will it take me to drive to my destination,distance
do you know if my vacation request is still pending,pto_request_status
how many calories are in vanilla ice cream,calories
my bags didn't make it to the new orleans airport,lost_luggage
append my playlist with smooth operator by sade,update_playlist
check out my location up on the map,current_location
when does my flight arrive,flight_status
do i need a visa to go to cuba,international_visa
find the meaning of qat,definition
how much is left of mastercard,balance
can you set me a reminder,reminder_update
that is affirmative,yes
"my card got damaged and i need to report it, please",damaged_card
what name would you like me to call you,what_is_your_name
tell me what the status of my american airlines flight is,flight_status
share my location with ma,share_location
why is my account blocked,account_blocked
where is my phone now,find_phone
is my at&t bill do soon,bill_due
reserve a table for 6 at morton's under the name jaime at 8:30pm,restaurant_reservation
"what time is it in fredericksburg, tx",time
"roll die, 6 sided",roll_dice
what items are on my shopping list,shopping_list
can you check the expiration date for my amex card,expiration_date
salutations!,greeting
how much will i pay in federal taxes,taxes
what type of plug do i need when in rome,plug_type
what's my bank routing number,routing
set my paycheck up for direct deposit,direct_deposit
i need to report a bent card,damaged_card
can you roll the 12 sided dice please,roll_dice
what's my credit rating,credit_score
change accent to male british,change_accent
what is the weather going to be like tomorrow,weather
my name is brad,change_user_name
how long is it safe to leave shrimp in the fridge,food_last
i was at costco trying to buy groceries and my card got declined,card_declined
are there any transaction fees associated with my usaa card if i am in south korea,international_fees
please speak with the whisper voice,whisper_mode
put on my shopping list i need carots,shopping_list_update
what timezone is london is,timezone
are my tires requiring a fill-up,tire_pressure
by what name do you refer to me,user_name
i want to hear my vaporwave playlist,play_music
please share my location with my boss and my lawyer,share_location
"check the apr on my disney visa, please",apr
how is the approval of my day off going,pto_request_status
can i turn on the alarm now,alarm
who sings this song,what_song
i let my bank know that i'm traveling to greece from march to april,travel_notification
i'm out of soap so will you order me some more,order
does life have a meaning,meaning_of_life
i need to make changes to my insurance policy,insurance_change
let's change the language for you,change_language
how much will i have to pay in state taxes,taxes
im going to be in slovakia from january 16th until january 19th,travel_notification
which marvel character has appeared in the most movies,oos
how much paid time off have i taken,pto_used
how many miles can i go with my current fuel level,gas
are you able to sub white sugar for brown sugar,ingredient_substitution
can you look up the carry-on restrictions for delta,carry_on
is there enough money in my account for expenses,balance
can i substitute vinegar for apple cider vinegar,ingredient_substitution
what timezone is vegas in,timezone
what's my apr on this card,apr
can you find a hearty lasagna recipe,recipe
what does the weather look like,weather
why is there a hold on my american saving bank account,account_blocked
try it with a male voice,change_accent
i have a lot of points saved up from my credit card rewards but don't know how to redeem them,redeem_rewards
does my card charge if i use it in china,international_fees
where can i find the mall closest to here,directions
italy is in what timezone,timezone
"what day is our next free day, please",next_holiday
what is my ac set to right now,smart_home
what kind of questions can i ask you,what_can_i_ask_you
this song needs to be added to my reggae playlist,update_playlist
can i switch cream with milk in a recipe,ingredient_substitution
i want to get reminded to clean my room,reminder_update
what are my shopping list's content,shopping_list
cash in rewards for my visa card,redeem_rewards
tell me how the weather is,weather
i want to set up direct deposit to my first hawaiian bank account,direct_deposit
when did i last service my car with an oil change,last_maintenance
is there traffic up ahead,traffic
i want to set direct deposit,direct_deposit
can you talk to me in chinese,change_language
how many days off did i use so far,pto_used
how many days does it take to receive a new card,replacement_card_duration
iterate the items on my todo list,todo_list
do i need a visa to get into canada later this year,international_visa
can you book me a room in new york city from april 2 through april 8,book_hotel
goodbye to you,goodbye
can you put smooth operator by sade on my playlist,update_playlist
do you know if whether or not zeus does reservations,accept_reservations
what is the definition of flange,definition
when should i expect my visa to expire,expiration_date
calender says tomorrow is,date
please clear entries on my calendar for the 1st,calendar_update
which timezone is buenos aires in,timezone
can you say that over,repeat
"hi, can you tell me the interest on my ira",interest_rate
whats the max i can spend on my visa,credit_limit
when will my tires need to be replaced,tire_change
i need a pto request for the dates jan 15th to jan 20th,pto_request
what is 606 divided by 5,calculator
which mechanic can check my check engine light,schedule_maintenance
i need to cancel my dinner reservation,cancel_reservation
where do i go to find my routing number for southpoint,routing
how much does it seem my state taxes will be,taxes
is my credit card expiration date approaching,expiration_date
please talk quietly,whisper_mode
i would like to know how to rollover my 401k,rollover_401k
did my order ever get distributed today,order_status
change back to default settings,reset_settings
flip it please,flip_coin
i need help booking a car rental in seattle,car_rental
add all of my points for my current discover card,rewards_balance
just call me dennis,change_user_name
move 57 dollars from saving into mom,transfer
i need your assistance on rolling over my 401k,rollover_401k
start a new text,text
on the tv,smart_home
i switched companies and need to rollover my 401k,rollover_401k
would you tell me the current time in the eastern timezone,time
what sort of fuel do i need for my car,gas_type
i'm driving from la to denver and need my bank notified,travel_notification
i need everything ordered on my shopping list,order
"when i go to mexico, what kind of plugs do i need",plug_type
can you tell me where flight dl123 is,flight_status
why are the funds in my bank account frozen,account_blocked
starbucks near me,directions
please help me apply for a silver card,new_card
yeah,yes
what's my total net worth in all of my bank accounts,balance
can you increase the speaker volume,change_volume
do you know any fun facts about shampoo,fun_fact
please immediately disconnect this mobile,sync_device
is there a better way to check my visa rewards card balance,rewards_balance
that is totally true,yes
i need to know if you are a real person or an ai,are_you_a_bot
what are the carry on rules for united,carry_on
turn on your whisper mode,whisper_mode
tell me some things to see in tampa,travel_suggestion
tell me how to check rewards for my mastercard,rewards_balance
do you own pets,do_you_have_pets
search for my routing number for my checking account with wells fargo,routing
i wanna know my income,income
please tell me today's date,date
is there are limit of carry ons for my flight with aer lingus to cork,carry_on
restore your original settings now,reset_settings
please do me a favor and call brother mario,make_call
set up a meeting with frank at 2pm,schedule_meeting
please create an alarm for 12 noon,alarm
confirm my taco house reservation for jean,confirm_reservation
how can my oil be changed in my car,oil_change_how
how can i adjust the spoken language,change_language
i am needing to know your name,what_is_your_name
look for a flight out of la to chicago on march 3rd for under $500,book_flight
help me locate my phone,find_phone
how long should i expect beef stroganoff to prepare,cook_time
how many years ago was al born,how_old_are_you
i would like to report my card as stolen,report_lost_card
"book a flight from miami, fl to columbus, ga on 16 february 2019 and returning on 2 march 2019",book_flight
"i would like to report my card as stolen, please",report_lost_card
turn off my bank account,freeze_account
take me to the closest walmart,directions
i need to know the time,time
tell me how many p's are in apple,spelling
"no, that is inaccurate",no
go ahead and book a reservation for 8 pm at red robin under the name kevin,restaurant_reservation
substitute for milk in pancakes,ingredient_substitution
can i get a credit increase for my visa,credit_limit_change
when can i hear the decision on my credit card application,application_status
what will the temperature be tomorrow,weather
where can i get my w2 forms from,w2
what is the calorie content of a scoop of chocolate ice cream,calories
"i need some more lysol, could you order me some",order
how can i know when my cable bill is due,bill_due
what weather should i expect,weather
i need to pay this month's tv subscription fee,pay_bill
"i want to pay my bill, please",pay_bill
i would like to know how much i pay in taxes,taxes
i wanna know the limit on my credit card,credit_limit
how do i get more checkbooks mailed to me,order_checks
i need information regarding the procedure to cash in my rewards for my citibank card,redeem_rewards
what day will my paycheck come,payday
what's the month that my card expires,expiration_date
i need to schedule car maintenance,schedule_maintenance
so does outback steakhouse have good reviews,restaurant_reviews
how many miles before i run out of gas,gas
when do i need my oil changed,oil_change_when
which meetings do i have today,meeting_schedule
please change accent to british male,change_accent
what do i do to jump start my car,jump_start
undo,cancel
how many days of vacation have i saved,pto_balance
what's your nationality,where_are_you_from
list some neat stuff about rats,fun_fact
please abort the current task,cancel
tell my bank i will be in brazil from june 1st to july 1st,travel_notification
where are your origins found,where_are_you_from
text sal and let them know the answer is yes,text
you need to help me find my cellphone,find_phone
create a new text,text
can you tell me what to do as i am in the airport and have been for some time and there is still no sign of my suitcase,lost_luggage
"is there anyway, i can report my card being stolen",report_lost_card
sound the alarm at 6 am tomorrow,alarm
i'd like to know what's on the shopping list,shopping_list
can you tell me my current salary,income
do you know the name of this song,what_song
what company's software engineers gave you life,who_made_you
confirm my reservation at dino's at 6 pm,confirm_reservation
can you provide me my credit score,credit_score
i want to know my recent spending,spending_history
what have i got on my to-do list,todo_list
on the 26th what is on the table for my calendar,calendar
did you hear back about my day off request,pto_request_status
get me instruction to change oil,oil_change_how
can you list off 4 star restaurants,restaurant_suggestion
please roll a 7 sided die,roll_dice
i need you to send ten dollars from bank of america to capital one,transfer
roll the dice for me,roll_dice
is my application processed for credit card,application_status
can you show me transactions related to utilities,transactions
positive,yes
how busy is ihop at 5 pm,how_busy
reserve a car rental for denver colorado for a ford between january 1st through 3rd,car_rental
"if my credit card was stolen, how long will it take to replace",replacement_card_duration
what are my options for jump starting my battery,jump_start
has my ordered arrived,order_status
i need an uber to get to dulles airport,uber
you were so kind to do that,thank_you
what do i need to do in order to redeem my credit card points,redeem_rewards
who were you made by,who_made_you
"my car is dead, what do i need to jump start it",jump_start
what's the way to make apple pie,recipe
can i make a reservation for 6 pm on the 21st at sidetracks,restaurant_reservation
i want a table at texas roadhouse; how long will it be,how_busy
what mexican restaurant within 5 miles has the best reviews,restaurant_suggestion
it was nice to catch up with you,goodbye
what's the last date i can use my credit card,expiration_date
please list ingredients for broccoli cheddar soup,ingredients_list
change the song to the next one,next_song
what should i do if my car battery is dead,jump_start
"if i fly internationally, do brittish airwaiys have carry-on limitations",carry_on
were you born in a hospital,where_are_you_from
delete everything from the task list,todo_list_update
what do you have my name saved under,user_name
roll 6 sided die,roll_dice
when did i most recently have my car in the shop,last_maintenance
i need to pay my water bill,pay_bill
could you tell me about my income,income
how can i get my w2 to do my taxes,w2
tell me if i am able to rollover my 401k,rollover_401k
i need to get some assistance figuring out how to rollover my 401k,rollover_401k
what is 2 francs in euros,exchange_rate
how many canadian dollars can i get for 5 us dollars,exchange_rate
make sure my alarm is set for three thirty in the morning,alarm
add a vet appointment for 5 pm on saturday,calendar_update
i want to pay my internet bill,pay_bill
call the bank and tell them i will be in france on the 16th until the 26th,travel_notification
"i'm hungry, where should i go",restaurant_suggestion
i wanna know the status of flight dl123,flight_status
what's the current weather,weather
i need to get a new motorcycle insurance plan,insurance_change
please go back to to factory settings now,reset_settings
what is the credit limit for my navy federal card,credit_limit
what is the news on my vacation request,pto_request_status
how long is it until payday,payday
what date were you created on,how_old_are_you
would you say you like dogs more or cats more,do_you_have_pets
will you set the timer,timer
please confirm my reservation for thursday at 10am,confirm_reservation
how many times can 12 go into 600,calculator
"siri, where is my iphone",find_phone
i think my card is stolen and needs to be reported,report_lost_card
i arrived on delta flight ab123 from juno but my luggage doesn't appear to have come with me,lost_luggage
what is the name of my insurance plan,insurance
how're you doing,greeting
what is 22 meters in inches,measurement_conversion
on my list of reminders is what,reminder
how much gas does this use in the city,mpg
i need to find my luggage,lost_luggage
find instructions for how to change the oil in a 2015 passat,oil_change_how
what name should i use when i call you,what_is_your_name
turn the lights down,smart_home
please tell me if my reservation is scheduled for sally's at 3 pm,confirm_reservation
what's the nutrient info for a donut,nutrition_info
i'm short on flour so place an order for me,order
are there any transaction fees associated with my amex card if i am in france,international_fees
are there fees for using my card in tampa,international_fees
what type of questions may i ask you,what_can_i_ask_you
how do they say goodbye in hawaii,translate
how high is my credit limit for my bank of america card,credit_limit
what are delta's carry-on restrictions,carry_on
remind me of the invoice total for my plumbing bill,bill_balance
call mymother,make_call
what are ways to improve my credit,improve_credit_score
i need the cooking length for a turkey,cook_time
can i use margarine instead of butter,ingredient_substitution
what questions are you programmed to answer,what_can_i_ask_you
what if you want a new credit card,new_card
hit me with a good joke,tell_joke
what is latin for i love you,translate
could you tell me what fun tourist things i could do in tokyo,travel_suggestion
can you help me report my lost card please,report_lost_card
who engineered you,who_made_you
about how long should you cook a 10 pound turkey,cook_time
tell me a joke about animals,tell_joke
i must know what the traffic typically like at 3:30 on the route to phoenix,traffic
thank you for helping me,thank_you
look to see if i have folding laundry on my to do list,todo_list
what time is it getting to be,time
"order new checks, please",order_checks
does minnies cafe in modesto take reservations,accept_reservations
will you add mopping to my to do list please,todo_list_update
what timezone is milan in,timezone
i need more candy so could you order me a pack,order
i want to change what accent you use,change_accent
can you change the volume to 4,change_volume
whats 5 feet in inches,measurement_conversion
do you know any good jokes,tell_joke
i need to know the dollar to peso conversion,exchange_rate
what is there on january 1st on my calendar,calendar
i would love to know my credit score,credit_score
what's the total vacation days i've gone through,pto_used
got any good dinner ideas,meal_suggestion
"hey, speak slowly",change_speed
i'd like a new life insurance plan,insurance_change
how are my state taxes looking,taxes
start playing the next track,next_song
what's the next scheduled holiday at this job,next_holiday
please turn on whisper mode,whisper_mode
do you know where i left my phone,find_phone
i replaced my tires last year when should i replace my tires again,tire_change
what did your friends call you,what_is_your_name
what are the estimates for the car's highway mpg,mpg
i want to redeem my card points for cash,redeem_rewards
i need the interest rate on my capital one account,interest_rate
find out for me how many days off i have taken in total at this point,pto_used
i would like a new insurance plan,insurance_change
in what status is my credit card application,application_status
how many students attend ucsb,oos
are you self employed,who_do_you_work_for
book me a meeting room for 12pm on february 28th,schedule_meeting
does the box have nutrition facts for cheerios on it,nutrition_info
get me an uber to chilis,uber
how many days until my amex card reaches it expiration date,expiration_date
tell me how to retrieve my pin number,pin_change
my chase card expires on what date,expiration_date
how do i know what interest rate chase has,interest_rate
report fraudulent activity on my credit card now,report_fraud
add up the calories in tacos,calories
can you talk at a normal speed please,change_speed
i miss placed my luggage i was on delta flight ab123 out of new york,lost_luggage
can you book me a hotel in los angeles near commerce casino from april 1st to the 5th,book_hotel
how do you spell hotdog,spelling
what do i say when i report a split credit card,damaged_card
i need an update on my online order from nespresso,order_status
do i have any meetings with michael today,meeting_schedule
when can i expect my next day off,next_holiday
time to get replacement credit card for stolen one,replacement_card_duration
"i can't locate my luggage, i was on jetblue flight ab123 out of detroit",lost_luggage
has my delivery order showed up,order_status
call bob for me,make_call
can you tell bill and craig where i am,share_location
put a hold on my bank of america account right away please,freeze_account
please set up an alarm to go off tomorrow at daybreak,alarm
"hey, ai",greeting
"please order some more cat food, i'm out",order
what's this song playing,what_song
"great talk, take it easy",goodbye
when's the next day off coming up,next_holiday
what subjects do you know something about,what_can_i_ask_you
do a hard reset to factory settings,reset_settings
i want to know your age,how_old_are_you
i must learn my routing number,routing
remind me friday to call my mother,reminder_update
i need to add dusting the bookshelf to my to do list,todo_list_update
will you get a coin and flip it,flip_coin
why cannot i take any money out from my bank account,account_blocked
tell me now if you are a bot,are_you_a_bot
tell me how to make chow mein,recipe
don't continue with what you're doing,cancel
i just started this new job and need help with my 401k rollover,rollover_401k
"siri, tell me where my iphone is",find_phone
create an alarm for 9 am and another one for 11 am,alarm
are pasta dishes healthy,nutrition_info
text my wife and tell her i'm divorcing her,text
who was your creator,who_made_you
ai find my phone,find_phone
can you tell me the definition of yttrbium,definition
what is my current net salary,income
how many miles per gallon do i get,mpg
do you think i can sub honey for sugar,ingredient_substitution
"could you play the next song on this playlist, please",next_song
